text,Sport specific mention,Equal opportunities / good opportunities in general,Physical contact/Masculine,Earnings related,Popularity and impact,Equal representation,Inclusive sport participation,Gender Equality,Women in Sports,Female representation,Discrimination themes,Media visibility / awareness,Other,Country,Gender
Everyone has fun,,,,,,,1,,,,,,,Sweden,Man
Because the physical female dog doesn't play a big role,,,1,,,,,,,,,,,Poland,Man
"Because there are two types, male and female.",,,,,,,,,,,,,1,Spain,Man
Women are being given importance,,,,,,,,,,,,,1,Spain,Man
I think that gender does not matter when deciding in this discipline,,,,,,,,,,,,,1,Poland,Man
because gymnasts in the Olympic games attract as much or more attention than men,1,,,,,,,,,,,,,Spain,Man
She is one of the first I saw women in sports.,,,,,,,,,,1,,,,Spain,Man
Everyone can do a little better or a little worse.,,,,,,,1,,,,,,,Poland,Man
There are more female gymnasts than male gymnasts.,1,,,,,,,,,,,,,Spain,Man
there are the same tournaments for men and women,,,,,,,,1,,,,,,Poland,Man
"It has women's tournaments as prestigious as the men's, they are televised like the men's, professional tennis players earn the same as men, they have an equal or greater following from the public than men.",1,,,,,,,,,,,,,Spain,Man
Because I believe in respect and equality.,,,,,,,,1,,,,,,Spain,Man
This is the experience in this area,,,,,,,,,,,,,1,Poland,Man
Exactly,,,,,,,,,,,,,1,France,Man
For everyone,,,,,,,1,,,,,,,France,Man
Many women practice it,,,,,,,,,,1,,,,France,Man
Everyone pursues the same goal,,,,,,,,1,,,,,,Germany,Woman
A sport that deploys all the energy,1,,,,,,,,,,,,,France,Man
I watch women's football more often,1,,,,,,,,,1,,,,Germany,Man
"Because there is, -again-, that is to say 25 years after the first introduction of a women's competition, a Women's TOUR DE FRANCE and, for example, for the TOUR DES FLANDRES, just after the he arrival of the runners in this event, there was _ and this was filmed and broadcast by EUROSPORTS 2_ an event reserved for female runners.",,,,,,,,,,,,1,,France,Man
Individual sport,,,,,,,,,,,,,1,France,Man
Because it is a niche sport,,,,,,,,,,,,,1,Poland,Man
There are all kinds of things mixed up,,,,,,,,,,,,,1,France,Man
Everyone can do this sport,,,,,,,1,,,,,,,France,Man
Gymnastics is practiced by both men and women,1,,,,,,,,,,,,,Poland,Man
"It is important to note that football, like many other sports, has historically been dominated by men and there are still obstacles to overcome when it comes to the inclusion of women in professional sport. However, it is true that football is often cited as one of the most gender-inclusive professional sports for several reasons: 1. Popularity: Football is the most popular sport in the world, which means that it enjoys global visibility and a significant fan base, which can help promote the inclusion of women in sport. 2. Changing mentalities: Over the years, there has been a changing mentality in professional football, with more and more support for women's teams, initiatives to promote gender equality and fight against discrimination, and an increase in the visibility of female athletes. 3. Professional structures: Many professional football leagues have developed structures for women's teams, providing professional and career development opportunities for players, which helps to strengthen the inclusiveness of the sport. 4. Success of women's teams: Women's national football teams have enjoyed great success and won international titles, which has helped increase the visibility and recognition of players, paving the way for greater inclusion of women in football. Although progress has been made, there is still work to be done to ensure true gender equality in professional football and sport in general.",1,1,,,1,,1,1,,1,1,,,France,Man
Feels more like a typical women’s sport,,,,,,,,,,,,,1,Germany,Woman
Women are more married,,,,,,,,,,1,,,,Sweden,Man
It's open to everyone,,,,,,,1,,,,,,,France,Woman
Because there have always been mixed doubles tournaments,,,,,,,,,,,,,1,France,Man
Because it's the most popular sport,,,,,1,,,,,,,,,Poland,Man
because it is a symmetrical reflection between the sexes,,,,,,,,,,,,,1,Poland,Man
Rather masculine,,,1,,,,,,,,,,,France,Man
everyone can take part in it regardless of age,,,,,,,1,,,,,,,Poland,Woman
"Men do exactly what women do (volleyball teams), what's more, they are subject to exactly the same rules (except for the height of the net, I guess).",1,,,,,,,,,,,,,Poland,Man
Women have been taking part in this sport for a long time,,,,,,,,,,1,,,,Poland,Man
because women are superior to men,,,,,,,,,,,,,1,France,Man
Because it's almost exactly on the same equal footing,,,,,,,,1,,,,,,Sweden,Man
Because in my opinion it is very fair there,,,,,,,,,,,,,1,Germany,Man
There is an equal amount of both,,,,,,,,1,,,,,,Germany,Woman
More open without stereotypes,,,,,,,,,,,,,1,France,Man
Mindset,,,,,,,,,,,,,1,France,Man
Because everyone can do this kind of gymnastics,1,,,,,,,,,,,,,Germany,Woman
Paraport in Chartres,,,,,,,,,,,,,1,France,Man
Equal prize money.,,,,1,,,,,,,,,,Sweden,Man
The participation of women and men is relatively equally visible,,,,,,,,1,,,,,,Poland,Man
It brings people and the public together,,,,,,,1,,,,,,,France,Man
Because most of the time men are conceived and rarely women,,,,,,,,,,1,,,,Germany,Woman
Women practice this sport with their own criteria,,,,,,,,,,,,,1,France,Man
The well-attended men's and women's events,,,,,,,,,,,,,1,France,Man
opinion based on intuition,,,,,,,,,,,,,1,Poland,Man
Because women also have a lobby there,,,,,,,,,,1,,,,Germany,Woman
You are in tomorrow today,,,,,,,,,,,,,1,Poland,Man
Support both boys and girls,,,,,,1,,,,,,,,France,Man
Because there are all sorts of opportunities there,,1,,,,,,,,,,,,Poland,Man
There can be no interpretation,,,,,,,,,,,,,1,France,Man
He receives the same bonuses,,,,,,,,1,,,,,,France,Man
Because it is most similar in terms of rewards to the case of Ania's gender,,,,,,,,,,,,,1,Poland,Man
Respect is very strong in this team sport,,,,,,,,,,,,,1,France,Man
No idea,,,,,,,,,,,,,1,France,Man
Historically,,,,,,,,,,,,,1,France,Man
I think there is an even distribution between men and women.,,,,,,,,,,,,,1,Sweden,Man
it's the one I see most women and men play.,,,,,,,,,,1,,,,Sweden,Man
Because women's football is coming,1,,,,,,,,,1,,,,Germany,Man
Fits women,,,,,,,,,,1,,,,Sweden,Man
Feels like that,,,,,,,,,,,,,1,Sweden,Man
Hockey,,,,,,,,,,,,,1,Sweden,Man
Many women,,,,,,,,,,1,,,,Sweden,Man
The women are also noticed and there is mixed,,,,,,,,,,,,,1,Sweden,Man
Equally talented but not the same salary,,,,,,,,1,,,,,,Sweden,Man
Because the general interest in events is almost the same,,,,,,,,1,,,,,,Germany,Man
see playing areas.,,,,,,,,,,,,,1,Germany,Man
There are more women playing,,,,,,,,,,1,,,,Sweden,Woman
I think it looks like that,,,,,,,,,,,,,1,Sweden,Man
Football is appreciated regardless of gender,1,,,,,,,,,,,,,Sweden,Man
it's so,,,,,,,,,,,,,1,Germany,Man
Feels most balanced,,,,,,,,,,,,,1,Sweden,Man
Earnings are largely the same here (including advertising revenue).,,,,1,,,,,,,,1,,Germany,Man
an equal sport,,,,,,,,1,,,,,,Germany,Man
Women have made the most progress here,,,,,,,,,,,,,1,Germany,Man
Because it is at the centre of visibility and fewer grievances remain in the shadows.,,,,,,,,,,,,,1,Germany,Man
Women are equal,,,,,,,,1,,,,,,Germany,Man
"Unfortunately, women were allowed to play football",1,,,,,,,,,,,,,Germany,Man
because all kinds of people practice,,,,,,,,,,,,,1,France,Man
there are the same competitions for women and men,,,,,,,,1,,,,,,Germany,Woman
we see men and women,,,,,,,,,,,,,1,France,Man
because I think there are more women represented,,,,,,,,,,1,,,,France,Woman
"Individual sport, great importance given to imagination.",,,,,,,,,,,,,1,France,Man
they don't make a difference,,,,,,,,,,,,,1,France,Woman
Women's teams,,,,,,,,,,,,,1,Germany,Woman
Same representation for men and women,,,,,,,1,,,,,,,France,Woman
Because it is known,,,,,,,,,,,,,1,France,Man
Because women play men too,,,,,,,,,,1,,,,France,Woman
There is more variety of gender,,,,,,,,,,,,,1,Spain,Woman
It is normally a mixed sport,,,,,,,,,,,,,1,France,Woman
There is full representation,,,,,,,1,,,,,,,Spain,Woman
It is for both sexes,,,,,,1,,,,,,,,Spain,Man
Because many people see it,,,,,,,,,,,,,1,Spain,Man
More athletes and more calls. Attention,,,,,,,,,,,,,1,Spain,Man
premiums are equivalent for men and women,,,,,,,,,,,,,1,France,Man
Because there are many female participants,,,,,,,,,,1,,,,Spain,Woman
There is a lot of variety in gymnastics and it is a sport for both women and men.,1,,,,,,,,,,,,,Spain,Woman
It is considered feminine,,,,,,,,,,,,,1,Spain,Woman
because the woman's body is not sexualized,,,,,,,,,,,,,1,Spain,Woman
There aren't too many women's competitions,,,,,,,,,,1,,,,France,Man
"Being a more individual sport, the rights are the same for all players",,,,,,,,1,,,,,,Spain,Woman
It's equal,,,,,,,,1,,,,,,Spain,Woman
Less problems,,,,,,,,,,,,,1,Spain,Woman
Athletes are treated equally.,,,,,,,,1,,,,,,Spain,Man
I think there are more women than in other sports.,,,,,,,,,,1,,,,Spain,Woman
Professional tennis players are more recognized,1,,,,,,,,,,,,,Spain,Man
The genders that have fewer opportunities in other sports in Gymnastics are older.,1,1,,,,,,,,,,,,Spain,Man
Because it is usually individual,,,,,,,,,,,,,1,Spain,Man
Any participant is matched,,,,,,,,,,,,,1,Spain,Man
Salaries can be high in both,,,,,,1,,,,,,,,Spain,Woman
I perceive it like this,,,,,,,,,,,,,1,Spain,Woman
can be played,,,,,,,,,,,,,1,Spain,Man
by force,,,,,,,,,,,,,1,Spain,Woman
It is attributed to women,,,,,,,,,,1,,,,Spain,Woman
There are many men's and women's soccer teams and there is a lot of support for both.,,,,,,1,,,,,,,,Spain,Woman
There are male and female gymnasts alike.,1,,,,,,,,,,,,,Spain,Woman
This sport does not have as much physical resistance as others and there are more women,,,1,,,,,,,1,,,,Spain,Woman
Because there are the same events for men and women.,,,,,,,,1,,,,,,Germany,Woman
I find that men and women are highlighted in the same way,,,,,,,,1,,,,,,France,Woman
I see no differences in the treatment of gymnasts based on their gender.,1,,,,,,,,,,,,,Spain,Woman
A lot of women,,,,,,,,,,1,,,,France,Man
Women have two high financial prizes,,,,1,,,,,,,,,,Spain,Man
Because it has a little more visibility,,,,,,,,,,,,,1,Spain,Woman
because both genres are professionalized,,,,,,1,,,,,,,,Spain,Man
Because there are already women's teams that can enter the championships,,,,,,,,,,,,,1,Spain,Woman
outfit,,,,,,,,,,,,,1,Poland,Man
"Because there are both men's and women's competitions, although these charge less",,,,,,1,,,,,,,,Spain,Woman
It has become professional and brings,,,,,,,,,,,,,1,Spain,Man
Because it is valued equally,,,,,,,,1,,,,,,Spain,Woman
Because female tennis players enjoy almost the same privileges and popularity as their male counterparts.,1,,,,1,,,,,,,,,Spain,Woman
It seems to me,,,,,,,,,,,,,1,Spain,Man
"Because according to the comments of anonymous people, women should not play soccer because it is a waste of time and money because nobody sees it.",,,,1,,,,,,,,,,Spain,Man
Equity,,,,,,,,,,,,,1,Spain,Woman
"Women have been competing in this sport for many years with great results and the structure is quite good, both at a technical and infrastructure level.",,,,,,1,,,,,,,,Spain,Man
It's more feminine,,,,,,,,,,,,,1,Spain,Woman
There are more women,,,,,,,,,,1,,,,Spain,Woman
Because I feel that it has more diffusion in the country where I live.,,,,,,,,,,,,,1,Spain,Woman
at least that's what it seems to me...,,,,,,,,,,,,,1,Poland,Man
Because it's where I've seen the most gender inclusion,,,,,,,,,,,,,1,Spain,Woman
there are many possibilities for everyone,,,,,,,1,,,,,,,Poland,Woman
Tradition,,,,,,,,,,,,,1,Spain,Man
For some time there has been greater respect,,,,,,,,,,,,,1,Spain,Man
Because it is very egalitarian,,,,,,,,1,,,,,,Spain,Man
They have been promoting equality between women and men athletes for years,,,,,,,,1,,,,,,Spain,Man
give everyone a chance,,,,,,,1,,,,,,,France,Man
I associate it most with a genderless sport,,,,,,,,,,,,,1,Poland,Woman
seen on television,,,,,,,,,,,,,1,Spain,Man
Because volleyball brings together both men and women,1,,,,,,,,,,,,,Poland,Woman
Because I think it is the most popular in the world,,,,,1,,,,,,,,,Spain,Man
There are women and men football,1,,,,,,,,,,,,,Germany,Woman
There is no division in this sport,,,,,,,,,,,,,1,Poland,Woman
Everyone can be equally good at this discipline,,,,,,,,1,,,,,,Poland,Woman
Popularity,,,,,1,,,,,,,,,Poland,Man
anyone can go through fear,,,,,,,,,,,,,1,Poland,Woman
same salary,,,,,,,,1,,,,,,France,Man
equality,,,,,,,,1,,,,,,Poland,Woman
"I don't think cycling is the most gender-inclusive sport. I think it is a professional sport, like many others in which there is gender inclusion.",,,,,,,1,,,,,,,Spain,Man
It strives to equalize the earnings of women and men,,,,1,,,,,,,,,,Poland,Woman
Because women's earnings are similar to men's,,,,1,,,,,,,,,,Poland,Man
"because it is the most popular sport among fans, inclusivity would have the largest group of potential recipients",,,,,1,,1,,,,,,,Poland,Man
Most women,,,,,,,,,,1,,,,Poland,Woman
Because the consumption of force is equal,,,,,,,,1,,,,,,Poland,Man
Individual,,,,,,,,,,,,,1,Sweden,Woman
It is equated equally,,,,,,,,1,,,,,,Spain,Man
Because it is where more women participate.,,,,,,,,,,1,,,,Spain,Man
I'm not sure why but it just seems to me that women as well as men are welcome in this sport,,,,,,,,,,,,,1,Poland,Woman
I think so,,,,,,,,,,,,,1,Poland,Man
It is not dominated by one gender,,,,,,,,,,,,,1,Poland,Woman
Just feels like one of the more inclusive sports,,,,,,,1,,,,,,,Sweden,Woman
It is the same in men and women,,,,,,,,1,,,,,,Spain,Man
It is rather feminine but suitable for Ho.bresvtsmvue.,,,,,,,,,,,,,1,Spain,Man
"Women's tennis is as popular as men's tennis, there are many female tennis stars, the earnings of women and men are at a similar level",1,,,1,1,,,,,,,,,Poland,Woman
Men and women play tennis and are successful,1,,,,,,,,,,,,,Poland,Woman
"Golf is not a contact sport and compared to the other disciplines mentioned, there are not such large differences in the possibilities and achievements between men and women",1,,,,,,,,,,,,,Poland,Man
"No, not quite",,,,,,,,,,,,,1,France,Man
Win the same except Grand Slam,,,,,,,,1,,,,,,France,Man
D I can see most clearly that the sexes have the same amount of transmission time.,,,,,,,,1,,,,,,Germany,Woman
No restrictions,,,,,,,,,,,,,1,Poland,Man
I have never seen women playing,,,,,,,,,,1,,,,Spain,Man
I guess because of tradition,,,,,,,,,,,,,1,Spain,Man
They have given him more notoriety,,,,,,,,,,,,,1,Spain,Man
Because men have priority,,,,,,,,,,,,,1,Germany,Woman
Because it seems to me to be the most economically and socially balanced professional sport when it comes to recognizing female athletes.,,,,,,,,,,,,,1,Spain,Man
Equal pay and equal attention,,,,1,,,,,,,,,,Sweden,Man
There have been women's competitions for many years,,,,,,,,,,1,,,,Spain,Man
The successes of both genders are recognized more equally,,,,,,,,1,,,,,,Spain,Man
"Because they charge the same in the selection, when no one is interested, it is interesting to",,,,,,,,1,,,,,,Spain,Man
this is what it looks like,,,,,,,,,,,,,1,Poland,Man
"It is associated with a sport least dominated by the stronger sex, so in my opinion it can bring together members of other genders equally.",,,,,,,,1,,,,,,Poland,Man
Mixed tournaments,,,,,,,,,,,,,1,Spain,Man
Tennis is for both men and women,1,,,,,,,,,,,,,Sweden,Man
Comparable physical needs,,,1,,,,,,,,,,,Poland,Man
Genders are promoted equally,,,,,,,,1,,,,,,Germany,Woman
"It is not the sport with the most inclusion, but it is where women are becoming more important lately.",,,,,,,,,,,,,1,Spain,Man
It indicates reality as the basis for evaluation,,,,,,,,,,,,,1,Poland,Man
there are more female gymnasts,1,,,,,,,,,,,,,Spain,Man
"Yes, that's true",,,,,,,,,,,,,1,Poland,Man
It's for agile people,,,,,,,,,,,,,1,France,Man
Not so stereotypical,,,,,,,,,,,,,1,Sweden,Woman
It's easy to find yourself,,,,,,,,,,,,,1,Poland,Man
The male and female categories compete in the same space and time,,,,,,,,1,,,,,,Spain,Man
"no divisions, everyone has equal rights",,,,,,,,1,,,,,,Poland,Man
Because you can see the importance they give is less,,,,,,,,,,,,,1,Spain,Man
In view as for women and men,,,,,,,,,,,,,1,France,Man
because many women play,,,,,,,,,,1,,,,Spain,Man
The prizes are the same as those of the men's tournaments,,,,1,,,,,,,,,,Spain,Man
It was mostly women who participate in this sport.,,,,,,,,,,1,,,,Sweden,Man
I think it best represents,,,,,,,1,,,,,,,France,Man
Women don't earn as much as men,,,,,,,,,,,,,1,Poland,Man
Because,,,,,,,,,,,,,1,Poland,Man
Because I play myself,,,,,,,,,,,,,1,Germany,Man
There are disciplines in which gender does not matter and results are not dependent on gender,,,,,,,,,,,,,1,Poland,Man
There are thousands of both sexes,,,,,,1,,,,,,,,Sweden,Woman
From a feeling point of view,,,,,,,,,,,,,1,Germany,Woman
Greater variety,,,,,,,,,,,,,1,Sweden,Woman
the biggest money,,,,1,,,,,,,,,,Poland,Man
Because they are male,,,,,,,,,,,,,1,Sweden,Man
The benefits of victories and advertising,,,,,,,,,,,,1,,France,Man
Evenly distributed number among competitors,,,,,,,,,,,,,1,Sweden,Woman
Both sexes can play it equally well.,,,,,,,,1,,,,,,Sweden,Man
That because of the biological differences between men and women,,,,,,,,,,,,,1,Poland,Man
"I see it in my club, equal board, actively seeking dialogue with everyone and competitions where everyone is invited regardless of gender/perception",,,,,,,,1,,,,,,Sweden,Woman
women win over men,,,,,,,,,,,,,1,Poland,Man
is only for men,,,,,,,,,,,,,1,Poland,Man
because anyone can grow it,,,,,,,,,,,,,1,Poland,Man
"Because apart from separate pairs, there are also mixed matches in the game",,,,,,,,,,,,,1,Poland,Man
Favors men,,,,,,,,,,,,,1,Poland,Man
Because gymnastics is relatively equal,1,,,,,,,,,,,,,Poland,Man
There are a lot of teams...,,,,,,,,,,,,,1,France,Man
Many women who are talented,,,,,,,,,,1,,,,Sweden,Man
Because it's cool,,,,,,,,,,,,,1,Poland,Man
there is the slightest difference in favoring men,,,,,,,,,,,,,1,Poland,Man
"There are no big differences because we use our hands for everything, so they are always strong.",,,,,,,,,,,,,1,Poland,Man
Everyone can participate on equal terms,,,,,,,,1,,,,,,Sweden,Woman
They just feel that way,,,,,,,,,,,,,1,Sweden,Woman
First a women's sport,,,,,,,,,,,,,1,France,Man
because only men play there,,,,,,,,,,,,,1,Poland,Man
Equality of disciplines,,,,,,,,1,,,,,,Poland,Man
because it is an elite sport and the players themselves have an influence on the results they achieve,,,,,,,,,,,,,1,Poland,Man
"Because it is a Sport in which men and women compete on equal terms, the Volleyball World initiative highlights this equality by promoting the wearing of jerseys with the names of players of both sexes and the organization is proud to be a leader in promoting gender equality and inclusivity",1,,,,,,1,1,,,,,,Poland,Man
Where I see most of both genders practicing the sport,,,,,,1,,,,,,,,Sweden,Woman
Man,,,,,,,,,,,,,1,France,Woman
Feels inclusive,,,,,,,1,,,,,,,Sweden,Woman
There are more women than in other sports,,,,,,,,,1,1,,,,France,Man
"Mixed tournament, alignment of prizes awarded",,,,1,,,,,,,,,,France,Man
Most popular,,,,,1,,,,,,,,,Sweden,Man
For arbitration,,,,,,,,,,,,,1,France,Man
"because there is more respect in this sport, at all levels",,,,,,,,,,,,,1,France,Man
Egalitarian TV transmission,,,,,,,,1,,,,1,,France,Man
Common since a long time with many men in the sport,,,,,,,,,,,,,1,Sweden,Woman
This is very relevant,,,,,,,,,,,,,1,France,Man
Yes,,,,,,,,,,,,,1,France,Man
Because both sexes can earn a lot,,,,,,1,,,,,,,,Germany,Woman
Because women are portrayed in the same way as men. You root for both,,,,,,1,,,,,,,,Germany,Woman
Because it brings together all genders without any distinction,,,,,,,1,,,,,,,France,Man
because we can see both genres there,,,,,,1,,,,,,,,France,Man
The difference in level is enormous,,,,,,,,,,,,,1,France,Man
For all,,,,,,,,,,,,,1,Sweden,Man
Known team the same,,,,,,,,1,,,,,,France,Woman
Yes,,,,,,,,,,,,,1,France,Man
Lots of media coverage,,,,,,,,,,,,1,,France,Man
This is not good,,,,,,,,,,,,,1,Germany,Woman
Yes,,,,,,,,,,,,,1,France,Woman
Many women who play handball,,,,,,,,,,1,,,,Germany,Woman
Because it is most popular and fun,,,,,1,,,,,,,,,Sweden,Man
It looks good,,,,,,,,,,,,,1,Sweden,Man
Gets equal attention,,,,,,,,1,,,,,,Germany,Woman
more women represented,,,,,,,,,,1,,,,Germany,Man
Easy to play,,,,,,,,,,,,,1,Sweden,Man
Seems to be so,,,,,,,,,,,,,1,Sweden,Man
Fr,,,,,,,,,,,,,1,Germany,Woman
Popular women's teams that get a place in the media and the news,,,,,1,,,,,,,1,,Sweden,Man
Women's soccer,,,,,,,,,,,,,1,Sweden,Man
So much publicized,,,,,,,,,,,,,1,France,Man
"The world's most popular sport has several practitioners, in this case also women",,,,,1,,,,,1,,,,Sweden,Man
Great sport,,,,,,,,,,,,,1,Sweden,Man
Have a lot of community there,,,,,,,,,,,,,1,Sweden,Man
"Think that football for girls is not at the same level, they earn less",1,,,,,,,,,,,,,Sweden,Man
what kind of women,,,,,,,,,,,,,1,Germany,Man
Has a disability system,,,,,,,,,,,,,1,Sweden,Man
light,,,,,,,,,,,,,1,Germany,Man
"There, everyone has the same opportunities in the sport",,1,,,,,,,,,,,,Sweden,Man
Equal pay,,,,1,,,,,,,,,,Germany,Man
More often women represent the sport,,,,,,,,,,1,,,,Sweden,Man
Because women,,,,,,,,,,1,,,,Sweden,Man
Because it is about us playing and not and equality,,,,,,,,1,,,,,,Germany,Man
I think a good gender inclusive,,,,,,,1,,,,,,,Sweden,Man
Have heard it,,,,,,,,,,,,1,,Sweden,Man
Many women in the professional sector,,,,,,,,,1,1,,,,Germany,Man
Maturity,,,,,,,,,,,,,1,Sweden,Man
I see volleyball as a gender-neutral sport that is physically versatile due to the physical fitness,1,,1,,,,,,,,,,,Germany,Man
Because it is,,,,,,,,,,,,,1,Germany,Man
better fees,,,,,,,,,,,,,1,Germany,Man
Most women historically,,,,,,,,,,1,,,,Sweden,Man
Because there are only men,,,,,,,,,,1,,,,Germany,Man
There are women’s and men’s competitions under the same conditions in all competitions,,,,,,,,1,,,,,,Germany,Man
Few female players,,,,,,,,,,,,,1,Germany,Man
Own World Cup,,,,,,,,,,,,,1,Germany,Woman
because there are more and more good female athletes,,,,,,,,,,,,,1,Germany,Man
Amount of prize money,,,,1,,,,,,,,,,Germany,Man
Since there is no team evaluation but individual evaluation,,,,,,,,,,,,,1,Germany,Man
No,,,,,,,,,,,,,1,Germany,Man
One sees,,,,,,,,,,,,,1,Germany,Man
No difference in perception and payment visible,,,,1,,,,,,,,,,Germany,Man
"viewers watch the female and males equally, unlike most of those sports on the list where I think you imagine the men’s sports first. If you are asked to imagine a gymnast you would think of a man or a woman, whereas if you think of a footballer or rugby player I think you would imagine a man first.",1,,,,,,,,,,,,,UK,Woman
Yes,,,,,,,,,,,,,1,UK,Man
Fun,,,,,,,,,,,,,1,UK,Woman
It's an all inclusive game,,,,,,,1,,,,,,,UK,Woman
It's fun for everyone,,,,,,,1,,,,,,,UK,Woman
by tradition,,,,,,,,,,,,,1,Spain,Man
It has always had competitions by gender and in couples of different sexes.,,,,,,,,,,,,,1,Spain,Man
I think that in gymnastics the world is upside down.,1,,,,,,,,,,,,,Spain,Man
Women have always participated and offered the same interest to the public.,,,,,,,,1,,,,,,Spain,Man
In sight it is,,,,,,,,,,,,,1,Spain,Man
By tradition,,,,,,,,,,,,,1,Spain,Woman
By history it is the sport where genders have the most representation.,,,,,,,1,,,,,,,Spain,Man
All men and women do it and the women are way better at it,,,,,,,,,,1,,,,UK,Man
Because it always includes women,,,,,,,,,,1,,,,Spain,Woman
Because of the hardness,,,,,,,,,,,,,1,Spain,Man
There are more women,,,,,,,,,,1,,,,Spain,Woman
is more popular,,,,,1,,,,,,,,,Spain,Man
Cycling is a sport with more gender inclusion,,,,,,,,,,,,,1,Spain,Man
Women have the same possibilities,,,,,,,,1,,,,,,Spain,Woman
Relates to entities and genres,,,,,,,,,,,,,1,Spain,Woman
Maybe it's because I've been seeing women playing tennis professionally forever.,1,,,,,,,,,,,,,Spain,Woman
"It has always been a sport in which there was no distinction and people have been included, according to their abilities, their worth, regardless of whether it was January, it was male or female.",,,,,,,,,,,,,1,Spain,Man
Because there have always been gymnasts of both genders with specific tests for one or the other but due to their physical characteristics.,1,,1,,,,,,,,,,,Spain,Man
Because I see many men and women participating,,,,,,,,,,1,,,,Spain,Woman
BECAUSE IT IS A SPORT THAT WOMEN HAVE ALWAYS PRACTICED,1,,,,,,,,,1,,,,Spain,Woman
Good,,,,,,,,,,,,,1,UK,Man
Offers same to both and men,,,,,,1,,,,,,,,UK,Woman
Women earn good money,,,,1,,,,,,,,,,UK,Woman
More women involved,,,,,,,,,1,1,,,,UK,Woman
I see a lot of female gymnastics,1,,,,,,,,,,,,,UK,Woman
Both genders participation is very high,,,,,,1,,,,,,,,UK,Man
Lots of women are in that sport,,,,,,,,,1,1,,,,UK,Woman
Guess,,,,,,,,,,,,,1,Sweden,Woman
I see a lot of people doing this,,,,,,,,,,,,,1,UK,Woman
Because the ladies in Sweden have been cruel in football! Better than the gentlemen! So it's a feeling that I like this!,1,,,,,,,,,,,,,Sweden,Woman
Because it is my opinion,,,,,,,,,,,,,1,Germany,Man
It has always been equal,,,,,,,,1,,,,,,UK,Woman
Less talk about women playing football,1,,,,,,,,,,,,,Sweden,Woman
fair,,,,,,,,,,,,,1,Germany,Woman
Feels like more girls are married,,,,,,,,,,,,,1,Sweden,Man
