text,Sport specific mention,Equal opportunities / good opportunities in general,Physical contact/Masculine,Earnings related,Popularity and impact,Equal representation,Inclusive sport participation,Gender Equality,Women in Sports,Female representation,Discrimination themes,Media visibility / awareness,Other,Country,Gender
because it’s basically a women’s sport,,,,,,,,,,1,,,,France,Woman
"Apart from men, we see more and more women",,,,,,,,,,1,,1,,France,Woman
Not enough women,,,,,,,,,,1,,,,France,Woman
Athletes are treated the same,,,,,,,,1,,,,,,France,Woman
because both genders can win competitions on the same criteria,,,,,,1,,,,,,,,France,Woman
Basketball,,,,,,,,,,,,,1,France,Woman
Because there are the same challenges for women as for men.,,,,,,,,1,,,,,,France,Woman
It's a sport that requires more thought than brute force and mixed teams are perfectly compatible,1,,,,,,,,,,,,,France,Woman
"I think tennis is more suitable for all genders, it takes technique more than strength",1,,,,,,,,,,,,,France,Woman
We only talk about them,,,,,,,,,,,,,1,France,Woman
There are also strong women who can play this,,,,,,,,,,,,,1,Germany,Woman
Different teams,,,,,,,,,,,,,1,Germany,Woman
Because women can also play well,,,,,,,,,,1,,,,Germany,Woman
Because women are very famous for gymnastics,1,,,,1,,,,,1,,,,Germany,Woman
In most disciplines there are competitions for both women and men,,,,,,1,,,,,,,,Germany,Woman
Well paid,,,,,,,,,,,,,1,Germany,Woman
There are no limits to anyone's ability to take it,,,,,,,,,,,,,1,Poland,Woman
because it is female dominated and male persons are treated equally,,,,,,,,1,,,,,,Germany,I identify in another way
because,,,,,,,,,,,,,1,Poland,Man
Anyone can do it,,,,,,,,,,,,,1,Poland,Woman
"In this discipline, it is easiest to enforce inclusivity in sports environments",,,,,,,1,,,,,,,Poland,Woman
an elite discipline in which women have always been involved and are not discriminated against,,,,,,,,,,,1,,,Poland,Man
because there are no limits for either women or men,,,,,,,,,,,,,1,Poland,Woman
Because Justyna Kowalczyk took part in the competition despite her pregnancy and it is a sport for people with strong fitness,,,,,,,,,,,,,1,Poland,Woman
"Promoting gender equality in volleyball assumes that players wear special T-shirts with their own name and the name of a player of the opposite sex, and volleyball is a sport in which, at the international level, women and men compete on equal terms, equal pay and equal attention.",1,,,1,,,,1,,,,,,Poland,Man
Every club in the Bundesliga now has a women’s team,,,,,,,,,,,,,1,Germany,Woman
Because you hear a lot about it both among men and women,,,,,,,,,,1,,1,,Germany,Woman
The regulations have already been introduced,,,,,,,,,,,,,1,Poland,Man
is the simplest,,,,,,,,,,,,,1,Poland,Woman
Because of strength and stereotypes,,,,,,,,,,,,,1,Poland,Woman
It requires more than just strength,,,,,,,,,,,,,1,Poland,Man
Because it shows the possibility of man,,,,,,,,,,,,,1,Poland,Man
Both women and men are equally appreciated in this sport,,,,,,,,1,,,,,,Poland,Woman
Everyone can exercise,,,,,,,1,,,,,,,Poland,Man
Because each gender has the opportunity to develop and participate,,1,,,,,,,,,,,,Poland,Man
More focus on women,,,,,,,,,,,,,1,Germany,Woman
I feel so.,,,,,,,,,,,,,1,Germany,Woman
It is a sport suitable for both women and men,,,,,,1,,,,,,,,Poland,Woman
This is my impression due to the number of disciplines,,,,,,,,,,,,,1,Poland,Woman
Equal rewards in tournaments,,,,,,,,1,,,,,,Germany,Woman
Yes,,,,,,,,,,,,,1,Poland,Woman
There are more women tennis players than women in other sports,1,,,,,,,,1,1,,,,Spain,Woman
They participate together,,,,,,,1,,,,,,,Spain,Woman
there is more equality,,,,,,,,1,,,,,,Spain,Woman
Guarantee opportunities in women's teams,,1,,,,,,,,,,,,Spain,Woman
"In this discipline, I see no differences in access to resources or remuneration.",,,,,,,,,,,,,1,Poland,Woman
More ease for both genders,,,,,,1,,,,,,,,Spain,Woman
There are many gymnasts,1,,,,,,,,,,,,,Spain,Woman
"because there has been a lot of talk about it lately, and they have gained ground",,,,,,,,,,,,,1,Spain,Woman
Both genders are seen as equal,,,,,,,,1,,,,,,UK,Woman
It's simple,,,,,,,,,,,,,1,UK,Woman
Because the athlete generally performs alone and not in a team,,,,,,,,,,,,,1,Spain,Woman
women's competitions have been followed for a long time,,,,,,,,,,,,,1,Spain,Woman
So many types chances,,,,,,,,,,,,,1,UK,Man
I think Athletics is a solo sport so it is easier to be more inclusive.,,,,,,,1,,,,,,,UK,Woman
Top leagues for both men and women. Women referee men's games.,,,,,,1,,,,,,,,UK,Man
Women’s football is on the up and more coverage is being given to it,1,,,,,,,,,,,,,UK,Woman
It is the best known,,,,,,,,,,,,,1,Spain,Woman
Why do men and women participate?,,,,,,,,,,,,,1,Spain,Woman
"Gender has always been included, giving opportunities in a general sense",,1,,,,,,,,,,,,Spain,Woman
Because of machismo,,,1,,,,,,,,,,,Spain,Man
Decision making and equal participation of all genders,,,,,,,,1,,,,,,Spain,Woman
Because it is,,,,,,,,,,,,,1,Spain,Woman
See lots of women on it,,,,,,,,,,1,,,,UK,Man
More gender participation,,,,,,,,,,,,,1,Spain,Woman
More is allowed,,,,,,,,,,,,,1,Spain,Woman
because there are events for both males and females,,,,,,1,,,,,,,,UK,Man
Most played sport on the planet,,,,,,,,,,,,,1,UK,Man
Because I see that it is the one that most women play,,,,,,,,,,1,,,,Spain,Woman
Because there is still a lot of machismo,,,1,,,,,,,,,,,Spain,Woman
"It is a sport of flexibility, the female body is more prepared.",,,,,,,,,,,,,1,Spain,Woman
make good money,,,,1,,,,,,,,,,UK,Man
Men and women play big tornements,,,,,,,,,,,,,1,UK,Man
Olympics,,,,,,,,,,,,,1,UK,Man
Because it's a great sport.,,,,,,,,,,,,,1,Sweden,Man
Fairly equal,,,,,,,,1,,,,,,Sweden,Woman
It does not demand strength and masculinity,,,1,,,,,,,,,,,Sweden,Woman
All genders can participate,,,,,,,,,,,,,1,Sweden,Woman
Because it’s a macho environment,,,,,,,,,,,,,1,France,Woman
Men and women equality,,,,,,,,1,,,,,,France,Man
The same winning amount regardless of gender,,,,,,,,1,,,,,,Sweden,Man
Because we see as many women as men,,,,,,,,,,1,,,,France,Woman
Whether you are a woman or a man in this type of sport they have the same abilities,,,,,,,,1,,,,,,France,Woman
Because there is women's and men's football,1,,,,,,,,,1,,,,France,Woman
Everyone rides together,,,,,,,1,,,,,,,Sweden,Woman
"Whether it's athletics or gymnastics, I haven't seen much difference between the sexes in these sports over the years",1,,,,,,,,,,,,,Sweden,Woman
Because a lot of women play football,1,,,,,,,,1,1,,,,France,Man
Gymnastics for men and women for a long time,1,,,,,,,,,,,,,France,Man
It is more suitable,,,,,,,,,,,,,1,France,Woman
We hear less about it,,,,,,,,,,,,1,,France,Woman
Superior prestige of sports cars,,,,,,,,,,,,,1,France,Man
Bring everyone together,,,,,,,1,,,,,,,France,Man
Because that's what I think,,,,,,,,,,,,,1,France,Woman
Lots of diversity in this sport,,,,,,,1,,,,,,,France,Woman
Because it's the same team game and the same way of proceeding,,,,,,,,1,,,,,,France,Woman
Men are more valued than women,,,,,,,,,,,,,1,France,Woman
"What differentiates men from women is their ability to create muscle more easily, and in my opinion golf does not require a lot of muscle unlike others.",1,,,,,,,,,,,,,France,Woman
Yes,,,,,,,,,,,,,1,France,Woman
"A female-coded sport, however, started from a woman's perspective and may not feel as inclusive for men",,,,,,,1,,,,,,,Sweden,Woman
"it is a sport which is not considered a feminine or masculine sport, everyone is free to practice it as they wish: man or woman",,,1,,,,,,,,,,,France,Man
Because I find that there are as many men as women,,,,,,,,,,1,,,,France,Man
Girl,,,,,,,,,,,,,1,France,Woman
this sport is very good and very sporty,,,,,,,,,,,,,1,France,Woman
because it is mixed,,,,,,,,,,,,,1,France,Woman
It just feels that way,,,,,,,,,,,,,1,Sweden,Woman
Am used to seeing both women and men participating in the sport,,,,,,,,,,1,,,,Sweden,Woman
Big step in the right direction for women's soccer compared to a few years ago compared to men's soccer,,,,,,,,,,,,,1,Sweden,Woman
Both men and women,,,,,,1,,,,,,,,Sweden,Woman
I think men's and women's players earn relatively the same and get about the same amount of attention.,,,,,,,,1,,,,,,Sweden,Woman
I have read a little about it,,,,,,,,,,,,,1,Sweden,Woman
A lot,,,,,,,,,,,,,1,Sweden,Man
Lots of matches,,,,,,,,,,,,,1,France,Man
It's mostly girls who do them,,,,,,,,,,1,,,,Sweden,Man
More individual achievements that count and then it's free,,,,,,,,,,,,,1,Sweden,Man
Golf,1,,,,,,,,,,,,,France,Man
Good between genders,,,,,,,,,,,,,1,Sweden,Woman
Strong gender diversity,,,,,,,1,,,,,,,France,Man
gender neutral,,,,,,,,,,,,,1,Sweden,Man
I think that team sports in general are more inclusive except for rugby and football which have remained very conservative it seems to me,1,,,,,,1,,,,,,,France,Man
the prices received are the same,,,,,,,,1,,,,,,France,Man
Because it's the same rules for both sexes,,,,,,1,,,,,,,,France,Man
Women have been doing athletics for a long time,,,,,,,,,,1,,,,France,Man
Because all genders can practice a physical sport,,,1,,,,,,,,,,,France,Man
It's everyone who plays,,,,,,,1,,,,,,,France,Man
Because there is a lot of diversity,,,,,,,1,,,,,,,France,Man
Team of all kinds,,,,,,,,,,,,,1,France,Man
Because it's the sport where I first heard about women's competitions,,,,,,,,,,,,1,,France,Man
Because athletes compete based on their hormones,,,,,,,,,,,,,1,France,Man
Because everyone (man or woman) can do this sport together without separation.,,,,,,,1,,,,,,,France,Man
There are women who have become world stars,,,,,,,,,,1,,,,France,Man
There are many girls,,,,,,,,,,1,,,,France,Man
Gymnastics is a very well distributed sport,1,,,,,,,,,,,,,France,Man
it's a team sport,,,,,,,,,,,,,1,France,Man
It's an individual sport,,,,,,,,,,,,,1,France,Man
Everyone actually,,,,,,,1,,,,,,,France,Man
Mostly women who practice but there are also men,,,,,,,,,,1,,,,France,Man
Sounds a little more girly than the others,,,,,,,,,,,,,1,Sweden,Man
A lot of women,,,,,,,,,,1,,,,France,Man
Allows girls to succeed as much as men,,,,,,,,,,,,,1,France,Man
It is a male sport,,,,,,,,,,,,,1,Sweden,Woman
Most popular,,,,,1,,,,,,,,,Sweden,Man
It is the sport where I think they have come the furthest in their equality work and where the differences have evened out the most,,,,,,,,1,,,,,,Sweden,Man
Just guessing,,,,,,,,,,,,,1,Sweden,Man
I think so.,,,,,,,,,,,,,1,Sweden,Man
Because different limits apply to women,,,,,,,,,,1,,,,Germany,Woman
"It affects all sports, but football is always talked about.",1,,,,,,,,,,,,,Germany,Woman
Because all genders are judged under the same conditions.,,,,,,,,1,,,,,,Germany,Woman
Participation possible for both,,,,,,1,,,,,,,,Germany,Woman
Because it is made for everyone and because no one is disadvantaged,,,,,,,1,,,,,,,Germany,Woman
Because all genders are represented there,,,,,,,1,,,,,,,Germany,Woman
There have long been successful women’s as well as men’s leagues,,,,,,,,,,,,,1,Germany,Woman
Because both should practice this sport,,,,,,1,,,,,,,,Germany,Woman
"Yes, because it is neither a women's sport nor a male-dominated sport. Gymnastics is very neutral in terms of gender and is therefore the most gender-fair",1,,,,,,,,,,,,,Germany,Woman
Many women and men play tennis,1,,,,,,,,,1,,,,Germany,Woman
Because here there are most likely approximately equal numbers of athletes of different genders and the earning potential has the smallest difference,,,,,,,,1,,,,,,Germany,Man
Anyone can do this,,,,,,,,,,,,,1,Germany,Man
I see no differences between women's and men's football in the rules,1,,,,,,,,,,,,,Germany,Man
It is just like that,,,,,,,,,,,,,1,Germany,Woman
No preferential treatment,,,,,,,,,,,,,1,Germany,Woman
"I am not an expert when it comes to sports, but I feel that the conditions should be almost the same for all genders",,,,,,,,1,,,,,,Germany,Man
Has started to get more attention in both the media and in society in general,,,,,,,,,,,,1,,Sweden,Woman
"Due to the long history of practicing this discipline by women and participating in sports authorities,",,,,,,,,,,,,,1,Poland,Man
Because both men's and women's matches are highly watched,,,,,,1,,,,,,,,Poland,Woman
Pure gut feeling,,,,,,,,,,,,,1,Germany,Man
"Because there we also have success on the women's side, they have just as many sponsors if not more.",,,,,,,,,,,,,1,Sweden,Woman
It has been seen over the years,,,,,,,,,,,,,1,Sweden,Woman
It feels like all genders play basketball the same amount.,,,,,,,,1,,,,,,Sweden,Woman
There are the same tracks,,,,,,,,1,,,,,,Sweden,Man
everyone has equal opportunities,,1,,,,,,1,,,,,,Poland,Man
I hear and see equally from both. It doesn't feel as alien to see men in gymnastics as women in rugby,1,,,,,,,,,1,,1,,Sweden,Woman
A feeling would have chosen equestrian sport if there had been a choice,,,,,,,,,,,,,1,Sweden,Woman
It seems to me that equality will be the first to be experienced here,,,,,,,,1,,,,,,Poland,Woman
Volleyball is a sport in which there are many actions promoting equality.,1,,,,,,,1,,,,,,Poland,Woman
Yep,,,,,,,,,,,,,1,Sweden,Woman
"Because hardly anyone watches women's football, female soccer players earn much less",1,,,,,,,,,,,,,Poland,Man
Soccer women are seen in the media the most,,,,,,,,,,,,1,,Sweden,Woman
Mostly guys playing,,,,,,,,,,,,,1,Sweden,Woman
More women than in other sports,,,,,,,,,1,1,,,,Sweden,Woman
Matches are not shown on television,,,,,,,,,,,,,1,Sweden,Woman
Because football is the perfect sport for women and men,1,,,,,,,,,,,,,Poland,Woman
The competitions take place simultaneously at the same location.,,,,,,,,1,,,,,,Sweden,Woman
Because you make the most money from the sport,,,,1,,,,,,,,,,Sweden,Man
The Polish women's and men's volleyball league has a similar level of sponsorship and broadcasting,1,,,,,,,,,,,1,,Poland,Woman
No stereotyping of athletics,,,,,,,,,,,,,1,Poland,Woman
"In tennis, as far as I know, women and men get the same prize money",1,,,1,,,,,,,,,,Germany,Man
My intuition tells me so,,,,,,,,,,,,,1,Poland,Woman
Women and men represent this discipline equally,,,,,,,1,,,,,,,Poland,Woman
Women are more flexible,,,,,,,,,,1,,,,Poland,Woman
You can play both in a wheelchair and in a stroller,,,,,,1,,,,,,,,Poland,Woman
I think so,,,,,,,,,,,,,1,Poland,Woman
Features that indicate winning are not related to gender,,,,,,,,,,,,,1,Poland,Woman
It is the most accessible.,,,,,,,,,,,,,1,Germany,Woman
Because it's the most popular game in the world,,,,,1,,,,,,,,,Poland,Woman
Because there are mixed-sex couples in tournaments,,,,,,,,,,,,,1,Poland,Man
"sure, why not",,,,,,,,,,,,,1,Sweden,Man
Because women can't play rugby,1,,,,,,,,,,,,,Poland,Man
Because it's mainly men who play,,,,,,,,,,1,,,,Poland,Man
"I rarely come across the words men's athletics or women's athletics, as is the case, for example, in football.",1,,,,,,,,,,,,,Poland,Man
Both women and men can play,,,,,,1,,,,,,,,Poland,Man
I know from experience that every man likes watching women's volleyball,1,,,,,,,,,,,,,Poland,Man
because women love this sport very much,,,,,,,,,,1,,,,Germany,Man
Everyone has the same chances to win and play,,,,,,,,1,,,,,,Germany,Man
Skills are taken into account,,,,,,,,,,,,,1,Germany,Woman
Mixed pairs,,,,,,,,,,,,,1,Sweden,Man
It feels like a liberating sport,,,,,,,,,,,,,1,Sweden,Man
Popular,,,,,1,,,,,,,,,Sweden,Man
Gymnastics is practiced by both women and men and is very popular.,1,,,,1,,,,,,,,,Germany,Man
"After all, there are the Paralympics",,,,,,,,,,,,,1,Germany,Man
"Therefore, you have not stopped working on a new type of Rickards",,,,,,,,,,,,,1,Sweden,Man
Is as common with women as men in that sport,,,,,,,,,,,,,1,Sweden,Man
A number of women have their voices heard and have the opportunity to influence,,1,,,,,,,,,,1,,Sweden,Man
same amount on TV,,,,,,,,,,,,1,,Germany,Man
I always see a lot of women and men playing there.,,,,,,,,,,1,,,,Germany,Man
Interesting,,,,,,,,,,,,,1,Sweden,Man
Is generally accepted for both men and women,,,,,,1,,,,,,,,Sweden,Man
Yes,,,,,,,,,,,,,1,Germany,Man
Gut feeling,,,,,,,,,,,,,1,Germany,Man
"Among cyclists, half are always/mostly men and the other half are women",,,,,,,,,,,,,1,Germany,Man
Because equally difficult conditions arise for both,,,,,,,,1,,,,,,Germany,Man
I've seen this before,,,,,,,,,,,,,1,Germany,Man
I think it matters less if you are male or female and more about technology,,,,,,,,,,,,,1,Sweden,Man
women dominant sport,,,,,,,,,,,,,1,Sweden,Man
Because there is for everyone,,,,,,,1,,,,,,,Sweden,Man
Women are just as active as men,,,,,,,,,,1,,,,Sweden,Man
Because everyone plays in a professional league,,,,,,,1,,,,,,,Germany,Man
Women have their own league and are even good there,,,,,,,,,,1,,,,Germany,Man
Women have competed as long as I can remember,,,,,,,,,,1,,,,UK,Woman
Because women can play to,,,,,,,,,,1,,,,UK,Man
Much more publicity,,,,,,,,,,,,,1,UK,Man
As women football is becoming muxg more popular and mainstream,1,,,,1,,,,,,,,,UK,Woman
Because everyone knows their role,,,,,,,1,,,,,,,UK,Man
Because it's fun,,,,,,,,,,,,,1,UK,Man
Because there are many more women than in other sports,,,,,,,,,1,1,,,,France,Woman
You can measure everything precisely.,,,,,,,,,,,,,1,Germany,Man
Because men have more power than women,,,,,,,,,,,,,1,France,Woman
Because he goes on TV for women sometimes,,,,,,,,,,,,1,,France,Man
the best supervised,,,,,,,,,,,,,1,France,Woman
Because most of them are guys,,,,,,,,,,1,,,,France,Woman
Because there is also women's football which is recognized,1,,,,,,,,,,,,,France,Woman
we see as many women as men,,,,,,,,,,1,,,,France,Woman
These are a physical sport that requires strength,1,,1,,,,,,,,,,,France,Man
because there is everyone to mix,,,,,,,1,,,,,,,France,Man
There are only guys,,,,,,,,,,,,,1,France,Woman
"More women are represented, training can be mixed. Women have easy access to accommodation and training facilities",,,,,,,,,,1,,,,France,Woman
Because I see more women there,,,,,,,,,,1,,1,,Germany,Woman
A lot of women,,,,,,,,,,1,,,,France,Woman
Because there comes out many differences between a man and woman.,,,,,,,,,,,,,1,UK,Woman
Because they have both male and mixed doubles,,,,,,1,,,,,,,,UK,Woman
Have grown up watching both female and male champions in this sport,,,,,,1,,,,,,,,Sweden,Woman
still a lot of things to do,,,,,,,,,,,,,1,France,Man
"They have a -league- where, just like with the men, you are stars and earn accordingly. Everyone also has more or less the opportunity to try tennis as it does not require much.",1,1,,,,,,,,,,,,Sweden,Man
Because there are girls and boys,,,,,,,,,,,,,1,Germany,Woman
Fairgane,,,,,,,,,,,,,1,Sweden,Woman
because we like to see little girls,,,,,,,,,,,,,1,France,Man
Also mixed doubles,,,,,,,,,,,,,1,Germany,Woman
That's just how it is,,,,,,,,,,,,,1,Germany,Woman
It is the most gender inclusive sport in my opinion..I have been watching the games as a kid and I must say It gives room for both  female and male players.I have been watching since I was a teenager and I have so many female players that i like and recognize.,,,,,,,1,,,,,,,UK,Man
Because women's soccer wins more than men's soccer,,,,,,,,,,1,,,,Sweden,Woman
Money goes to their heads and they think they are above everything,,,,1,,,,,,,,,,France,Woman
Mixes doubles is common,,,,,,,,,,,,,1,UK,Man
Many women practice it,,,,,,,,,,1,,,,France,Man
More inclusive,,,,,,,1,,,,,,,Sweden,Woman
More women than in other sports,,,,,,,,,1,1,,,,France,Woman
Participation of both sexes is equal,,,,,,,,1,,,,,,Sweden,Man
We only see male broadcasts,,,,,,,,,,,,1,,France,Woman
There are men and women football,1,,,,,,,,,,,,,Germany,Man
Women’s football has always existed,1,,,,,,,,,,,,,Germany,Woman
Both sexes have a level playing field,,,,,,1,,,,,,,,UK,Man
Do not know,,,,,,,,,,,,,1,Sweden,Woman
A lot of girls are shown doing it and publicised,,,,,,,,,,,,,1,UK,Woman
Question of feeling,,,,,,,,,,,,,1,France,Man
Equality TV broadcasting,,,,,,,,1,,,,1,,France,Woman
It's a common game,,,,,,,,,,,,,1,UK,Man
There are mixed teams,,,,,,,,,,,,,1,Sweden,Woman
Because he is the one who democratized women,,,,,,,,,,,,,1,France,Woman
Because there are mixed competitions,,,,,,,,,,,,,1,Sweden,Woman
There are the same amount of women as men competing and they both get shown on mainstream tv,,,,,,,,,,,,1,,UK,Man
Just a feeling I have where both men and women get media space. Then I don't know what the actual decision-making looks like,,,,,,,,,,,,1,,Sweden,Man
Feeling,,,,,,,,,,,,,1,Sweden,Man
Think it’s always been fully acceptable,,,,,,,,,,,,,1,UK,Woman
You see as many women as men competing in all types of athletics,,,,,,,,,,1,,,,UK,Woman
What does gender inclusive mean?,,,,,,,,,,,,,1,Sweden,Man
Because it's for girls,,,,,,,,,,1,,,,France,Woman
Competing in the same arena,,,,,,,,1,,,,,,Sweden,Man
I just seem to see a lot of female golfer of the internet,1,,,,,,,,,,,,,UK,Man
About skill not gender,,,,,,,,,,,,,1,UK,Woman
definitely,,,,,,,,,,,,,1,Poland,Woman
Man and woman competing,,,,,,,,,,,,,1,France,Woman
there are the same or very similar events for all,,,,,,,,1,,,,,,UK,Woman
Because all have played for many years,,,,,,,,,,,,,1,UK,Woman
I think that both women and men are welcome there and both are interested in it,,,,,,1,,,,,,,,Germany,Woman
Feeling that it has many female practitioners,,,,,,,,,,1,,,,Sweden,Woman
Both sexes played for years,,,,,,1,,,,,,,,UK,Woman
I'm not that familiar with cycling but it feels like a sport where women & men have the same conditions,,,,,,,,1,,,,,,Sweden,Woman
no discriminatory dress codes,,,,,,,,,,,1,,,Germany,Woman
Perception of equal value,,,,,,,,1,,,,,,Sweden,Woman
It's the most high profile,,,,,,,,,,,,,1,UK,Woman
It has women’s football,1,,,,,,,,,,,,,UK,Woman
both can play,,,,,,1,,,,,,,,UK,Man
Personal opinion,,,,,,,,,,,,,1,France,Man
"Gymnastics combines predispositions that both men and women can have, i.e. strength and flexibility.",1,,,,,,,,,,,,,Poland,Woman
Everyone can take part in it,,,,,,,1,,,,,,,Poland,Woman
because famous tennis stars are both women and men,1,,,,1,,,,,,,,,Poland,Woman
Because I believed it,,,,,,,,,,,,,1,Sweden,Woman
I just have that impression.,,,,,,,,,,,,,1,Germany,Man
Because it is a sport that is often classified as female and there are many women who get opportunities in gymnastics,1,1,,,,,,,,,,,,Sweden,Woman
Is a feeling I have,,,,,,,,,,,,,1,Sweden,Man
Most.popular women,,,,,1,,,,,1,,,,Poland,Woman
Shows the most equal in genders,,,,,,,,1,,,,,,UK,Woman
I think so,,,,,,,,,,,,,1,Poland,Woman
Bpde men and women compete in the same context,,,,,,,,1,,,,,,Sweden,Woman
Men and women have always participated at the same level with same coverage,,,,,,,,1,,,,,,UK,Woman
is recognized,,,,,,,,,,,,,1,Germany,Woman
There are as many men as women,,,,,,,,,,1,,,,France,Man
Both are watched and covered as much as eachother,,,,,,1,,,,,,,,UK,Man
"When shown on television, both genders are valued.",,,,,,1,,,,,,,,UK,Man
The female stars are respected and not compared to men,,,,,,,,,,,,,1,Sweden,Man
It is a promoted sport,,,,,,,,,,,,1,,Poland,Woman
Women can succeed in sports just as much as men,,,,,,,,,,,,,1,Sweden,Woman
Both women and men can participate,,,,,,1,,,,,,,,Poland,Woman
both men and women's athletics are showcased on TV equally and have been for a long time. Also both boys and girls do athletics at school,,,,,,,,,,,,1,,UK,Woman
"Both sexes are able to compete, there are no limits due to strength",,,,,,1,,,,,,,,Poland,Woman
I see a lot of women and men on the Olympic athletics,,,,,,,,,,1,,,,UK,Woman
Both women and men play golf,1,,,,,,,,,,,,,Poland,Woman
Men only,,,,,,,,,,,,,1,Sweden,Woman
The one we talk about more these days,,,,,,,,,,,,,1,France,Woman
It just is,,,,,,,,,,,,,1,Sweden,Man
Same retribution for Roland garroq,,,,,,,,1,,,,,,France,Woman
It encourages both gender,,,,,,1,,,,,,,,UK,Man
"Safe, slightly pleasant, less emotions and that's what women prefer",,,,,,,,,,,,,1,Poland,Woman
Very good sport,,,,,,,,,,,,,1,Sweden,Man
Because there are often women in clubs,,,,,,,,,1,1,,,,Poland,Man
There are equal opportunities for everyone.,,1,,,,,,1,,,,,,Germany,Man
Because only men do it,,,,,,,,,,1,,,,Poland,Woman
Its the most loved sport in the world by all,,,,,,,,,,,,,1,UK,Man
the player is often alone in deciding,,,,,,,,,,,,,1,France,Woman
There is an equal division between genders,,,,,,,,1,,,,,,Poland,Woman
Because it's a sport for women,,,,,,,,,1,1,,,,Poland,Man
Because it is the one that has the most voice in both men and women,,,,,,,,,,1,,,,Spain,Woman
"It is not necessary to have large muscles and therefore the biological gap between women and men is almost non-existent, being equal.",,,,,,,,1,,,,,,Spain,Woman
Paralypic Games,,,,,,,,,,,,,1,France,Woman
Everything is correct,,,,,,,,,,,,,1,Spain,Woman
Because men and women participate equally.,,,,,,,,1,,,,,,Spain,Man
both are equally poorly supported,,,,,,,,1,,,,,,Germany,Man
I hear more about women’s/men’s football than any other sport,1,,,,,,,,,1,,1,,UK,Woman
because there are both women and men in golf,1,,,,,,,,,,,,,Sweden,Man
Attack exactly,,,,,,,,,,,,,1,Poland,Woman
women's football is also popular,1,,,,1,,,,,,,,,Spain,Woman
Because practically only men play,,,,,,,,,,1,,,,Spain,Man
The example of our winners of my feminine dial,,,,,,,,,,,,,1,Spain,Woman
There is still a long way to go but important steps are being taken in my country.,,,,,,,,,,,,,1,Spain,Man
Because all aspects are more equitable,,,,,,,,,,,,,1,Spain,Man
It's where I see more athletes come out,,,,,,,,,,,,1,,Spain,Man
It is a purely feminine sport,,,,,,,,,,,,,1,Spain,Man
Everyone has equal chances,,,,,,,,1,,,,,,Poland,Man
